Fed Chair Powell gives starkest warning yet on potential economic consequences from tariffs | CNN Business
Google faces $6.6 billion lawsuit in Britain for alleged abuse of dominance in online search | CNN Business
Want to reduce your dementia risk? A shingles vaccine could help | CNN
"Chinese factories are flooding TikTok with luxury goods. Not so fast, experts say | CNN Business"
Nvidia takes $5.5 billion hit as US clamps down on its China chips | CNN Business
China’s economy grew by 5.4% in first quarter of 2025 | CNN Business
Boeing shares fall on report that China has halted its deliveries as part of trade war | CNN Business
Good ways to put your tax refund to use | CNN Business
"American Airlines, last of the major carriers, is adding free Wi-Fi | CNN Business"
Pfizer ends development of potential pill obesity treatment | CNN
"US begins probes into pharmaceutical and chip imports, setting stage for tariffs | CNN Business"
Fear of unemployment jumps to highest level since the pandemic | CNN Business
"New antibiotic is effective against gonorrhea, could be first new treatment since 1990s, study says | CNN"
Billionaire Ray Dalio is worried Trump’s tariff war could spark ‘something worse’ than a recession | CNN Business
"‘It’s incredibly concerning’: Dozens of Facebook black market groups offer rideshare and delivery driver accounts for sale, researchers say"
Trump says free trade killed American automaking jobs. That’s not the whole story | CNN Business
China’s Xi arrives in Vietnam on Southeast Asia tour to strengthen ties as Trump focuses his trade war on Beijing
Why tourist information centers are some of Asia’s top tourist attractions
US stock futures rise amid temporary tariff exemptions for tech products | CNN Business
"Trump official says tariff exemptions on tech are temporary. Elizabeth Warren calls trade war ‘red light, green light’ game"
Jet-Puffed marshmallows is selling a $2 Easter dye kit in response to egg-spensive prices
Trump’s drive against top universities could carry a big economic cost
‘Saturday Night Live’ roasts Trump’s tariff chaos of biblical proportions | CNN
Trump tariffs aim to encourage you to buy American. But even American maple syrup farmers are hurt by tariffs
German experiment gave people a basic monthly income – the effect on their work ethic was surprising | CNN
US consumer sentiment plummets to second-lowest level on records going back to 1952 | CNN Business
Trump has 90 days to do 150 trade deals. Financial markets aren’t buying it | CNN Business
"Trump’s immigration crackdown is hitting Modelo and Corona sales, CEO says | CNN Business"
Cheap things from China are poised to get pricey. Secondhand retailers are ready to take advantage | CNN Business
This key American business sector has a massive trade surplus with the rest of the world. Its jobs are at risk in a trade war.
Why chess is forging an unlikely partnership with esports
Xi Jinping says China ‘not afraid’ in first public comment on escalating tariff war with the US
"Live updates: Trump news, tariffs rattle stock market, US-China trade war"
CNN’s town hall with battleground members of Congress: Key takeaways
Trump is waiting for Xi to call. The Chinese see it differently | CNN Politics
Wall Street is seeing right through the Trump 2.0 spin | CNN Business
Global Art Sales Down In 2024
Here’s when iPhones may get more expensive | CNN Business
These tech leaders donated to Trump. Now they’re out billions of dollars | CNN Business
Trump wants to play market hero. But the economic damage is done | CNN Business
Inside Trump’s tariff retreat: How fears of a bond market catastrophe convinced Trump to hit the pause button
"Trump drug tariffs would drive up prices, worsen shortages before any boost to US manufacturing, experts warn | CNN"
"Nobel laureate: I owe America my success. Today, its scientific future is in danger | CNN"
"Grocery prices: Tariffs will make your coffee, seafood and fruit more expensive"
Trump’s tariff onslaught against China launches a battle the US may not be able to win
"US, global recession forecasts grow with Trump’s massive ‘reciprocal’ tariffs now in place"
Trump embraces ‘tailored’ tariff deals as foreign leaders look to sweeten their offers | CNN Politics
That was the sound of the dead cat bounce | CNN Business
‘Truly a moron’: Musk escalates spat with Trump trade adviser as he divides with White House over tariffs
"US trade official defends Trump’s tariffs, says almost 50 countries approached him to ‘explore how to achieve reciprocity’"
Trillions down the drain. Trump’s trade adviser Peter Navarro remains unbothered
Trump is trying to reinvent 1950 with his tariffs. He should be planning for 2050 | CNN Business
Rally in US stocks evaporates as White House doubles down on China tariffs | CNN Business
US stocks off to major bounce back from their tariff doom spiral | CNN Business
The extremely flawed logic behind Trump’s chaotic trade war | CNN Business
"Anti-vaccine sentiments may derail vaccines already awaiting FDA approval, experts fear | CNN"
China lashes out at JD Vance for calling Chinese people ‘peasants’ | CNN
Bessent’s Mar-a-Lago tariff message to Trump: zero in on the endgame | CNN Politics
"The markets just gave Trump an off-ramp. Your move, Mr. President | CNN Business"
How actual ‘fake news’ caused a market whiplash
"Fact check: Trump falsely says Europe doesn’t buy anything from US, wildly exaggerates trade deficit with China | CNN Politics"
US stocks enter bear market territory as tariff misery continues on Wall Street | CNN Business
Jamie Dimon sounds the alarm bell on tariffs | CNN Business
This is the stock market’s worst start to a presidential term in modern history | CNN Business
China plans to ‘turn crisis into opportunity’ as the world reels from Trump’s tariff war
Trump says he’s ready to talk as new stock market losses fuel tariff chaos
Nikkei 225: Plunges at least 8% after open
Why the war on government efficiency is anything but efficient | CNN
"Dow futures tumble more than 1,500 points as the massive market selloff continues | CNN Business"
"Trump’s team offers mixed messaging on tariff negotiation, downplays market volatility | CNN Politics"
Jellycats are everywhere. Why are we suddenly so obsessed?
Wondering if you should convert your tax-deferred retirement savings to a Roth? Here’s what to consider | CNN Business
Inside Trump’s defiant response to the markets’ tariff meltdown | CNN Politics
"The US economy added 228,000 jobs last month, but the unemployment rate ticked up | CNN Business"
"Dow plunges by more than 1,600 points after China retaliates against Trump’s tariffs | CNN Business"
Trump says he’s punishing foreign countries. He’s mostly punishing Americans | CNN Business
"Trump’s self-inflicted tariff crisis sparks confusion, chaos and questions of competence | CNN Politics"
"GOP lawmakers, foreign leaders and markets wait to see if Trump’s tariffs are open for negotiation | CNN Politics"
Why is Trump rewriting US economic history? Anyone? | CNN Politics
Stellantis layoffs hit five US auto plants that supply factories in Canada and Mexico
Dow plunges and dollar weakens as recession fears grip Wall Street | CNN Business
Everything is blowing up in Elon Musk’s face
DOGE drove layoff announcements to their third-highest-ever level in March | CNN Business
Everything is blowing up in Elon Musk’s face | CNN Business
"With some athletes ‘suffering financially,’ Michael Johnson hopes his new league can bring value to track and field"
"Europe prepares countermeasures to Trump’s tariffs, calling them a ‘major blow to the world economy’ | CNN Business"
Auto tariffs are now in effect. What it means for America - and you | CNN Business
Stock futures plunge as investors digest Trump’s tariffs | CNN Business
Fact check: Trump’s false claims about tariffs and trade | CNN Politics
Should you buy or lease your car now? | CNN Business
Supreme Court backs FDA’s denials of flavored vaping products for now | CNN Politics
Tesla sales plunge: Biggest decline in history | CNN Business
Trump set to roll out sweeping new ‘Liberation Day’ tariffs | CNN Business
US Senate committee opens review into Meta’s efforts to gain access to China | CNN Business
Trump doesn’t seem to understand how car prices work | CNN Business
Pro-marijuana group aims to sway Trump by airing ads around White House and Mar-a-Lago | CNN Politics
Europe warns Trump: We have ‘a strong plan’ for retaliation against tariffs | CNN Business
The most aggressive tariff move yet by the most tariff-obsessed president | CNN Business
TRUMP GAMBLES WITH AMERICANS' FINANCES
Wall Street is fed up with Trump’s tariffs. Stocks are off to their worst start to a year since 2020
