"When A Burger Costs $18, Red Robin’s $20 Burger Pass Feels Radical"
How To Grow A Small Business Sustainably
Dissh Became A Global Brand By Breaking Fashion’s Rules
The Market-Driven Clean Energy Shift—And Why Texas Matters
U.S. Businesses Can Benefit From International Treaties—If We Don’t Pull Out Of Them
"Amazon Promo Codes: Save Up To 80% On Gap, Eufy, Waterpik And More"
"The Best Shampoos For Fine Hair, According To Experts And Our Editors"
The What-Ifs: 5 Steps To Calm Your Today’s Worry Into 20/20
Malaysia’s 50 Richest 2025: Tycoons Get A Wealth Boost Despite Market Mayhem. Robert Kuok Remains Country’s Richest.
Indiana Senate Republicans Reject Cannabis Legalization Bid
The Clearing House Sees Growth In Its Real-Time Payments (RTP)
AI's Human Side: Wellbeing And The Quadruple Bottom Line
"China’s DeepSeek AI Poses ‘Profound Threat’ To National Security, House Report Claims"
A Declining Dollar Could Be A Tailwind For Energy Investors
Tesla’s California Sales Tank Amid A Grim Quarter For The Top EV Brand
Inside Six Ultra-Luxury Properties For Under $5 Million
The High Cost Of Free Parking: Why Cities Must Rethink Curb Space
Why American Workers Are Burnt Out And Exhausted
How To Succeed In Watches Without Being Rolex: British Watchmakers Edition
Test-Driving The 2025 Jaecoo 7 Super Hybrid System SUV
"20,000 AI-Generated Songs Uploaded To Deezer Every Single Day"
March Retail Sales Surge In Advance Of Trump Tariffs
"Trump’s Tariffs ‘Highly Likely’ To Boost Inflation, Says Fed Chair Powell"
4 Reasons Teens Should Create Their Summer Job
These ‘DOOM: The Dark Ages’ Xbox Controllers May Be The Best Ones Yet
Is This The Bottom For Wells Fargo Stock?
The High Price Of Poverty: How Financial Penalties Trap Low-Income Americans
18 Strategies To Maximize Lead Generation On A Tight Marketing Budget
19 Signs You May Be Too Focused On The Competition
"The Best Outdoor Sofas That Are Chic, Comfortable And Durable"
World Of Forbes: Stories Of Entrepreneurial Capitalism Across Our 43 International Editions
The Cloud 100 2025: Submissions Open For The 10th Annual Ranking Of The Best Private Cloud Companies
Kyle Tucker Is Mashing For The Cubs Before He Cashes In This Offseason
How To Stay Sane And Savvy When Markets Feel Like They Are Crashing
"The Best Mattresses Made In The USA, If You Want To Shop Close To Home"
Amazon Doesn’t Have ‘Any Plans For Premium Expansions’ In ‘Throne And Liberty’
What's Next For JBHT Stock?
Optimize Your Human Capital As You Start To Scale
Job Seekers Listen Up: 9 Specific Must-Haves That Recruiters Want
What's Next For UAL Stock?
What Eddie Murphy And Dan Akroyd Taught Me About Trading
Potential Medicaid Cuts Threaten Maternal Healthcare
21 Job Titles That Will Disappear By 2030
5 Systems That Make Your Business Scale While You Sleep
6 Bold Entrepreneur Moves To Profit From The Coming Global Power Shift
China Market Update: Nvidia Weighs On Asia Investor Sentiment
Here's Why There's A 'Silver Lining' For Nvidia After Trump’s China AI Chip Curb
Intel Cancels IPO Carveout Of Altera
"Survival Guide For Thinkers, Creatives, And Strategists In The AI Era"
Meta Stock To $400?
The Optimist’s Case For Bungie’s ‘Marathon’
Get Lit: Cannabis Infused Cocktails From Wellness Brand 1906 For 4/20
SickScience Is Biohacking Beauty With Vegan Exosomes
Duty Free Americas Creates New Brand For Lucrative $9.5 Billion Mega-Terminal At JFK Airport
Nvidia $5.5 Billion Hit: Buy Or Sell Now?
Will Trump Negotiate Tariffs? Japan Meeting At White House Today As Countries Say They Want Fair Deals
Amazon Stock To Crash To $120?
What’s In A Name? When It Comes To The New York Strip Steak The Political Connotations Matter
Wall Street Wins Big In The Midst Of Trump’s Tariffs Storm
Managing Risk In A Rapidly Evolving World
"The 2025 Forbes Iconoclast Summit Will Convene The Finance Industry’s Most Influential Dealmakers, Financial Titans, Investors And Market Movers"
The 9 Best Dehumidifiers For Basements To Keep Your Home Dry
The FTC Discredited Its Case Against Meta In Its Opening Statement
The Traditional Barrier Between PR And Marketing Has Fallen—How Brands Should Adapt
The Longevity Paradox: How Longer Lives Create New Financial Complexities
5 ChatGPT Prompts To Check If Your Business Idea Is Worth Millions
"You Missed A 3,000% Profit Opportunity On The S&P 500 - Be Prepared For The Next One"
Meta’s Antitrust Case May Lead To Instagram Spinoff
Minerals Supporting Sustainability: Why Ethical Investing Matters
The SPAC Is Back! Kodiak Initiates Autonomy Part Deux For Trucking
American Eagle Puts Fans In The Driver’s Seat With Live Your Life Affiliate Community
The Secret World Of Multimillion-Dollar Domain Deals
Earnings Preview: What To Expect From Netflix Results
Has More Chaos Stalled The Market Rally?
"Time To Buy? Gold At All-Time Highs, How To Play It"
Forbes Recession Tracker: Bank Of America Survey Finds Investors’ Economic Growth Expectations At 3-Decade Low
Easter Chocolate Demand Creates Supply Chain Squeeze
How Open-Source AI Is Shaping The Future Of Enterprise Innovation
Test-Driving The 2025 Toyota Sienna Hybrid
Nvidia To Take $5.5B Earnings Hit As Part Of Escalating Tensions With China
Will AI And Robotics Lead The Next Evolution In Travel?
Why Adaptive Reuse Is Among Toronto’s Smartest Trends
U.K. Visa Fees Leaving Science And Other Sectors Struggling For Talent
AI Is Changing Consumer Apps: Here's What That Means For Innovators
Navigating The Future Of Insurance: Collaboration And Regulation
"Pomona To Host Cricket At Los Angeles Olympics, As Hopes Dashed For Rival Cities"
Adobe: Why We're Bullish Now
Launching A Business In Dubai: What High-Net-Worth Entrepreneurs Need To Know
What To Expect From Nasdaq's Q1 Earnings?
Why A2P Messaging Is Becoming A Business Essential
Riding The Wave: The Challenge Of Marketing In The Evolving Web3 Space
Rare Rolex Daytona Expected To Command Up To $1.6 Million At Auction
"Restaurant Franchising - An Era Of Expansion, Tech, And Consumer Focus"
The LYMA Laser PRO Is Now Available In The U.S. And With FDA Clearance
Unmasking W. R. Berkley: The Overachiever You're Missing
Rock Bottom To Breakthrough: 7 Entrepreneurs Who Refused To Quit
Financial Discipline Is Always In Fashion
Forbes Daily: Why Harvard Can Afford To Reject Trump’s Demands
"Open Banking Sees Slow, But Steady Progress"
What Engineering Leaders Should Know About Cross-Platform Apps
